{
  "$schema": "https://json-schema.org/draft/2020-12/schema",
  "$id": "dotgame/study-index.schema.json",
  "title": "DotGame 학습 교재 목록 (data/study/index.json) v1",
  "type": "object",
  "required": ["version", "updated_at", "is_sample", "materials"],
  "properties": {
    "version": { "const": 1 },
    "updated_at": { "type": "string", "pattern": "^\\d{4}-\\d{2}-\\d{2}T\\d{2}:\\d{2}(:\\d{2})?\\+09:00$" },
    "is_sample": { "type": "boolean" },
    "note": { "type": "string" },
    "materials": {
      "type": "array",
      "items": {
        "type": "object",
        "required": ["id", "title", "file"],
        "properties": {
          "id": { "type": "string", "pattern": "^[a-z0-9_]+$", "description": "교재 파일의 id 와 동일" },
          "title": { "type": "string" },
          "subject": { "type": "string" },
          "page_count": { "type": "integer", "minimum": 1, "description": "PDF 총 페이지 수. 입력 범위 검증에 사용" },
          "file": { "type": "string", "pattern": "^[A-Za-z0-9_.-]+\\.json$", "description": "data/study/ 기준 파일명" }
        }
      }
    }
  }
}
